<?xml version="1.0" encoding="UTF-8"?>
<xs:schema xmlns:xs="http://www.w3.org/2001/XMLSchema" elementFormDefault="qualified" version="1.1">
    <xs:element name="book">
        <xs:complexType>
            <xs:sequence>
                <xs:element ref="title"/>
                <xs:element name="price" type="xs:decimal"/>
                <xs:element ref="authors"/>
                <xs:element name="press" type="xs:string"/>
                <xs:element name="pages" type="xs:integer"/>
                <xs:element name="description" type="xs:string"/>
                <xs:element name="cover" type="xs:string"/>
            </xs:sequence>
            <xs:attribute name="id" use="required" type="xs:ID"/>
            <xs:attribute name="isbn" use="required">
                <xs:simpleType>
                    <xs:restriction base="xs:string">
                        <xs:pattern value="\d{3}\-\d\-\d{3}\-\d{5}\-\d"/>
                    </xs:restriction>
                </xs:simpleType>
            </xs:attribute>
        </xs:complexType>
    </xs:element>

    <xs:element name="title">
        <xs:complexType mixed="true">
            <xs:attribute name="lang" use="required" type="xs:string"/>
        </xs:complexType>
    </xs:element>

    <xs:element name="authors">
        <xs:complexType>
            <xs:sequence minOccurs="1" maxOccurs="unbounded">
                <xs:element name="author" type="xs:string"/>
            </xs:sequence>
        </xs:complexType>
    </xs:element>

</xs:schema>
